{
  "id": "bvoh",
  "name": "BVOH (Butenediol Vinyl Alcohol Copolymer)",
  "aliases": ["Butenediol vinyl alcohol copolymer", "BVOH"],
  "status": "researched",
  "base_type": null,
  "variation_kind": null,
  "polymer_class": "support-soluble",
  "chemical_makeup": "Butenediol vinyl alcohol copolymer — an engineered water-soluble copolymer related to PVA but reformulated for faster dissolution, more stable extrusion and broader material compatibility",
  "summary": "The premium water-soluble support material: it dissolves faster and prints more stably than PVA, holds up over multi-day dual-material jobs, and pairs cleanly with PETG, ASA, nylon and even TPU where PVA struggles. The trade-offs are cost — often two to three times PVA — and the same extreme hygroscopy in storage.",
  "printing": {
    "nozzle_temp_c": { "min": 190, "max": 210, "recommended": 200 },
    "bed_temp_c": { "min": 45, "max": 90, "recommended": 60 },
    "ambient_temp_c": { "min": 15, "max": 30, "recommended": 22 },
    "speed_mm_s": { "min": 15, "max": 30, "recommended": 20 },
    "enclosure_recommended": false,
    "heated_chamber_required": false,
    "requires_hardened_nozzle": false,
    "part_cooling_fan_pct": { "min": 0, "max": 100, "recommended": 60 },
    "notes": "Nozzle temperature is consistent across BCN3D and Fiberlogy at 190-210 °C. Bed temperature is set by the model material rather than the BVOH: BCN3D quotes a wide 45-90 °C depending on what it is supporting, Fiberlogy a narrower 50-70 °C. No enclosure or heated chamber is called for; standard open-frame machines are fine. Speed is deliberately low — BCN3D recommends ~20 mm/s, and Prusa notes BVOH shares PVA's ~4 mm³/s maximum volumetric flow (versus ~15 mm³/s for PLA), so throughput is capped regardless of printer class. Part cooling guidance is broad (Fiberlogy 0-100 %, BCN3D 50-100 %); tune to bridging needs. Feed from a dry box."
  },
  "drying": {
    "required_before_use": "always",
    "temp_c": { "min": 60, "max": 70, "recommended": 65 },
    "time_hours": { "min": 4, "max": 12, "recommended": 8 },
    "methods": ["filament dryer", "food dehydrator", "convection oven at lowest setting", "drybox with desiccant (print directly from it)"],
    "dryness_validation": "No crackling or popping at the nozzle; consistent glassy extrusion; no bubbling or rough surface finish on the extruded strand",
    "notes": "Sources give two different schedules: BCN3D 70 °C for 4 hours, Fiberlogy 60 °C for 8-12 hours. Both are plausible and probably describe a quick refresh versus a thorough dry of a saturated spool — pick the longer, cooler cycle if the spool has been open. Transfer straight into a sealed dry box afterwards."
  },
  "storage": {
    "recommendations": "Airtight container or dry cabinet with fresh desiccant. Fiberlogy states the filament stays usable for up to 12 months if properly sealed. BCN3D notes BVOH absorbs moisture as fast as PVA but tolerates it better in practice — it will survive a multi-day (roughly two-day) print job where PVA would degrade mid-print.",
    "max_humidity_pct": 20,
    "hygroscopy": "extreme"
  },
  "price": {
    "usd_per_kg_low": 150,
    "usd_per_kg_high": 250,
    "notes": "Premium-priced and consistently more expensive than PVA across sources, reflecting more complex chemistry. Direct retail data point: Fiberlogy BVOH 0.5 kg at EUR 86.47 incl. VAT (roughly $95 for the spool at recent rates), implying about $150-250/kg. The per-kg USD figure is converted and estimated (unverified) — no direct USD retail listing was found."
  },
  "use_cases": {
    "recommended": [
      "dissolvable supports for PETG (better than PVA here per Prusa and BCN3D)",
      "supports for ASA and other engineering filaments",
      "supports for nylon and high-temperature blends",
      "complex overhangs and internal channels where clean dissolution and surface quality matter",
      "multi-day dual-material prints needing better stability than PVA",
      "supports for flexible materials such as TPU 98A"
    ],
    "not_recommended": [
      "standalone functional parts (dissolves in water, not load-bearing)",
      "food-contact parts",
      "outdoor or humid-exposure parts",
      "budget-constrained short or simple prints where PVA's lower cost is adequate"
    ]
  },
  "suitability": {
    "food_contact": "no",
    "load_bearing": "no",
    "high_temperature": "no",
    "outdoor": "no"
  },
  "properties": {
    "density_g_cm3": 1.14,
    "grams_per_100cm3": 114,
    "cm3_per_100g": 87.7,
    "glass_transition_c": 68.5,
    "max_service_temp_c": 55,
    "tensile_strength_mpa": { "min": 8.7, "max": 34, "recommended": 33.7 },
    "notes": "Density 1.14 g/cm³ agrees well across Fiberlogy/filament2print (ISO 1183) and the BCN3D/Ultrafuse TDS. Tg 68-69 °C also agrees closely (BCN3D 69, Fiberlogy 68); 68.5 recorded. Melting temperature ~175 °C. Tensile strength is strongly orientation-dependent: 33.7 MPa printed flat versus 8.7 MPa upright in the Z direction per BCN3D/Ultrafuse — a ~75 % drop. Fiberlogy separately reports 34 MPa with orientation unspecified, consistent with the flat figure. Max service temperature ~50-60 °C is inferred from Tg, not published (unverified). Shrinkage and HDT at 0.45 MPa are not documented for this material (unverified)."
  },
  "scores": {
    "ease_of_print": 5,
    "dimensional_stability": 6,
    "warp_tendency": 2,
    "layer_adhesion": 4,
    "compression_strength": 3,
    "temperature_tolerance": 2,
    "uv_tolerance": 1,
    "weather_tolerance": 1,
    "water_tolerance": 2
  },
  "compatibility": {
    "bonds_with": ["pla", "petg", "asa", "pa", "tpu"],
    "support_materials": [],
    "usable_as_support_for": ["pla", "petg", "asa", "pa", "tpu"],
    "notes": "BVOH's headline advantage over PVA is breadth: BCN3D and Prusa both recommend it over PVA for PETG, and Fiberlogy lists ASA, its PETG-family 'PLX', its PC/PA-family 'HI-TEMP' and 'HI-TEMP CF' lines, and TPU 98A as compatible primary materials. BCN3D states broadly that BVOH is compatible with almost all of their filaments. Like PVA it functions only as a support material and is not itself supported by another material, so support_materials is deliberately empty. Not documented for ABS (HIPS/limonene remains the traditional ABS support route) or for PC, PP, TPE, HIPS, PVA, PCTG, PVB and PET (unverified, no sourced guidance found)."
  },
  "plate_recommendations": [
    {
      "plate_id": "pei-textured",
      "rating": "usable",
      "notes": "The 45-90 °C bed range overlaps standard PEI operating conditions comfortably and no special release agent is typically required. In practice the model material, not the BVOH, dictates the first-layer and bed-temperature strategy."
    }
  ],
  "emissions": {
    "voc_level": "low",
    "particulate_level": "low",
    "primary_emissions": ["ultrafine particles"],
    "ventilation": "optional",
    "notes": "No dedicated emissions chamber study specific to BVOH was found, so this whole assessment is by analogy to PVA — a similar water-soluble alcohol-based chemistry printed at low temperature — and should be treated as unverified. On that basis it is generally regarded as lower-VOC and lower-UFP than the styrenic (HIPS/ABS) or nylon families, with no major named toxic monomer commonly cited. General FDM ventilation best practice still applies."
  },
  "safety_notes": "Dissolved BVOH leaves a viscous waste solution; dissolve supports in a bucket and dispose of the liquid per local guidance rather than pouring thick slurry down a drain. Warm water and agitation speed dissolution but keep the model material's own heat limits in mind when choosing bath temperature.",
  "additional_notes": "Choose BVOH over PVA when the model material is PETG, ASA, nylon or TPU, when the print runs more than a day, or when support-interface surface quality matters; choose PVA when the model is PLA, the print is short, and cost dominates. The pronounced Z-direction anisotropy (tensile falling roughly 75 % from flat to upright) matters mainly for tall thin support towers, which can snap during printing.",
  "provenance": {
    "sources": [
      "https://support.bcn3d.com/knowledge/bvoh-filament-bcn3d",
      "https://support.bcn3d.com/knowledge/bvoh-vs-pva",
      "https://bcn3d.com/wp-content/uploads/2021/02/BCN3D-Filaments-TDS-BVOH.pdf",
      "https://fiberlogy.com/3d-printing-bvoh-filament",
      "https://fiberlogy.com/en/BVOH-Filament-1_75mm-0_5kg",
      "https://bigrep.com/filaments/bvoh/",
      "https://help.prusa3d.com/article/water-soluble-materials-pva-bvoh_162860",
      "https://bcn3d.com/product/bvoh-bcn3d-filaments/"
    ],
    "last_verified": "2026-07-31",
    "confidence": "medium",
    "conflicts": "Drying schedule: BCN3D specifies 70 °C for 4 h, Fiberlogy 60 °C for 8-12 h — the recorded range spans both; the difference likely reflects a light refresh versus a thorough dry rather than a factual disagreement. Bed temperature: BCN3D 45-90 °C versus Fiberlogy 50-70 °C, union recorded. Part cooling: Fiberlogy 0-100 % versus BCN3D 50-100 %. Tensile strength varies ~4x with print orientation (BCN3D 33.7 MPa flat, 8.7 MPa upright) and Fiberlogy's 34 MPa does not state orientation. Price per kg is converted from a single EUR retail listing and is an estimate. Emissions data is entirely inferred by analogy to PVA — no BVOH-specific study found. Shrinkage, HDT and max service temperature are undocumented."
  }
}
