{
  "id": "pva",
  "name": "PVA (Polyvinyl Alcohol)",
  "aliases": ["Polyvinyl alcohol", "PVA", "PVOH", "PVA+"],
  "status": "researched",
  "base_type": null,
  "variation_kind": null,
  "polymer_class": "support-soluble",
  "chemical_makeup": "Polyvinyl alcohol — a water-soluble synthetic polymer produced by hydrolysis of polyvinyl acetate; biodegradable",
  "summary": "The classic water-dissolvable support material, used almost exclusively as the second extruder in multi-material prints rather than as a build material. It pairs best with PLA at similar print temperatures, but it is extremely hygroscopic: unprotected filament can absorb enough moisture in a couple of hours to clog, string, or fail mid-print.",
  "printing": {
    "nozzle_temp_c": { "min": 180, "max": 230, "recommended": 210 },
    "bed_temp_c": { "min": 45, "max": 60, "recommended": 55 },
    "ambient_temp_c": { "min": 15, "max": 30, "recommended": 22 },
    "speed_mm_s": { "min": 20, "max": 50, "recommended": 30 },
    "enclosure_recommended": false,
    "heated_chamber_required": false,
    "requires_hardened_nozzle": false,
    "part_cooling_fan_pct": { "min": 50, "max": 100, "recommended": 100 },
    "notes": "Prints fine on standard open-frame machines; no enclosure or chamber heat needed. Throughput is the real limit — Prusa rates PVA/PVA+ at roughly 4 mm³/s maximum volumetric flow versus ~15 mm³/s for PLA, so raising the nominal speed will not help. Sources disagree on part cooling: eSUN's TDS specifies 100 %, the Filament Cheat Sheet calls for moderate cooling only; both are plausible depending on the brand's additive package (unverified). Feed from a dry box or AMS at all times."
  },
  "drying": {
    "required_before_use": "always",
    "temp_c": { "min": 45, "max": 55, "recommended": 45 },
    "time_hours": { "min": 10, "max": 12, "recommended": 10 },
    "methods": ["filament dryer", "food dehydrator", "convection oven at lowest setting", "drybox with desiccant (print directly from it)"],
    "dryness_validation": "Filament feels hard and rigid rather than soft, tacky or rubbery; no popping, sizzling or visible steam at the nozzle tip; no stringing or bubbling in the extruded strand; consistent glassy extrusion rather than fuzzy or frosted",
    "notes": "eSUN specifies 45 °C for more than 10 hours. Move the spool straight from the dryer into a sealed dry box or AMS — leaving it out to cool in room air undoes the dry."
  },
  "storage": {
    "recommendations": "Airtight container with fresh desiccant — Bambu Lab specifically calls silica gel insufficient and recommends calcium chloride. At ~20 % RH the filament stays usable only 1-3 days; at typical room humidity (~55 % RH) freshly dried filament can go damp within 1-3 hours, so print from a sealed dry box or AMS rather than open air.",
    "max_humidity_pct": 20,
    "hygroscopy": "extreme"
  },
  "price": {
    "usd_per_kg_low": 50,
    "usd_per_kg_high": 120,
    "notes": "2025-2026 pricing for standard unfilled grades. Budget brands (eSUN) sit at the low end, roughly $50-70/kg equivalent on 0.5 kg spools; premium brands (Prusament) reach or exceed the top of the range. Most PVA ships as 0.5 kg spools, so per-spool cost looks lower than per-kg."
  },
  "use_cases": {
    "recommended": [
      "dissolvable supports for complex overhangs and internal channels",
      "supports for PLA prints (the best-established pairing)",
      "hollow and nested geometries requiring full support dissolution",
      "multi-material aesthetic PLA prints needing clean support interfaces",
      "enclosed cavity supports that cannot be reached mechanically"
    ],
    "not_recommended": [
      "standalone functional or load-bearing parts (weak and water-sensitive)",
      "outdoor or humid-environment parts",
      "long multi-day prints without a dry box or AMS (degrades mid-print)",
      "supports for ABS/ASA/PC (poor adhesion and mismatched print temperatures)",
      "food-contact parts"
    ]
  },
  "suitability": {
    "food_contact": "no",
    "load_bearing": "no",
    "high_temperature": "no",
    "outdoor": "no"
  },
  "properties": {
    "density_g_cm3": 1.24,
    "grams_per_100cm3": 124,
    "cm3_per_100g": 80.6,
    "glass_transition_c": 85,
    "max_service_temp_c": 75,
    "tensile_strength_mpa": { "min": 22, "max": 78 },
    "notes": "Density reported 1.23-1.25 g/cm³ (eSUN 1.25, Xometry 1.23); 1.24 recorded as the midpoint. Tg ~85 °C is general polymer-science/RepRap wiki data rather than a filament datasheet figure. Max continuous service temperature ~75 °C is a single Xometry figure (unverified); the polymer decomposes/pyrolyses above roughly 200 °C, which is why the usable nozzle window is narrow. Tensile strength is recorded as the full reported spread because eSUN's TDS (22 MPa) and Xometry (78 MPa) disagree by more than 3x — both are treated as unverified. Flexural strength 360 MPa (eSUN). Shrinkage and HDT are not commonly published for PVA support grades (unverified)."
  },
  "scores": {
    "ease_of_print": 3,
    "dimensional_stability": 4,
    "warp_tendency": 2,
    "layer_adhesion": 5,
    "compression_strength": 3,
    "temperature_tolerance": 2,
    "uv_tolerance": 1,
    "weather_tolerance": 1,
    "water_tolerance": 1
  },
  "compatibility": {
    "bonds_with": ["pla", "petg", "pa"],
    "support_materials": [],
    "usable_as_support_for": ["pla", "petg", "pa"],
    "notes": "PVA functions only as a support material — it is not itself supported by another material in normal use, so support_materials is deliberately empty. PLA is the best and most common pairing (matched print temperatures, clean interface). PETG and PA work with reduced reliability; Ultimaker documents PVA support for PLA, Tough PLA, Nylon and CPE (a PETG-family copolyester) on their systems. Not recommended with ABS and ASA (adhesion problems and mismatched bed/nozzle temperatures) or PC. No established guidance was found for PP, TPU, TPE, HIPS, BVOH, PCTG, PVB or PET (unverified)."
  },
  "plate_recommendations": [
    {
      "plate_id": "pei-textured",
      "rating": "usable",
      "notes": "Bed temperatures of 45-60 °C sit comfortably inside the normal PEI operating range. No release agent is typically needed, since PVA is printed as a co-material alongside the primary part and the primary material governs first-layer strategy."
    }
  ],
  "emissions": {
    "voc_level": "low",
    "particulate_level": "low",
    "primary_emissions": ["ultrafine particles"],
    "ventilation": "optional",
    "notes": "Generally regarded as lower-VOC and lower-UFP than the ABS/HIPS styrenic and nylon families, with no major named toxic monomer commonly cited (unlike styrene or caprolactam). PVA-specific emissions chamber-study data is sparse, so this assessment is by class analogy and low print temperature rather than direct measurement (unverified). General FDM ventilation best practice still applies."
  },
  "safety_notes": "Dissolved PVA support material produces a viscous waste water; let supports fully dissolve in a bucket and dispose of the liquid per local guidance rather than pouring thick slurry down a drain. Never dry PVA above ~55 °C — higher temperatures risk softening the spool and the polymer degrades well below normal high-temp drying ranges.",
  "additional_notes": "PVA is throughput-limited rather than speed-limited: at ~4 mm³/s the support material, not the model material, sets the print time for a dual-material job. Treat PVA as consumable — an opened spool left in room air is often no longer reliably printable even if it looks fine.",
  "provenance": {
    "sources": [
      "https://wiki.bambulab.com/en/filament-acc/filament/pva-printing-guide",
      "https://www.esun3d.com/uploads/eSUN_PVA-Filament_TDS_V4.0.pdf",
      "https://filamentcheatsheet.com/filaments/pva/",
      "https://www.xometry.com/resources/3d-printing/pva-3d-printing-filament/",
      "https://reprap.org/wiki/PVA",
      "https://www.simplify3d.com/resources/materials-guide/pva/",
      "https://support.bcn3d.com/knowledge/bvoh-vs-pva",
      "https://help.prusa3d.com/article/water-soluble-materials-pva-bvoh_162860",
      "https://www.3dsourced.com/guides/3d-printing-materials-cost/"
    ],
    "last_verified": "2026-07-31",
    "confidence": "medium",
    "conflicts": "Tensile strength: eSUN TDS reports 22 MPa, Xometry reports 78 MPa — a >3x disagreement that most likely reflects different PVA grades and test conditions; both retained as the recorded spread pending a single authoritative source. Nozzle temperature: eSUN 180-230 °C, Filament Cheat Sheet 180-220 °C, Xometry 215-225 °C — the union is recorded with a mid-range recommendation. Part cooling: eSUN specifies 100 %, Filament Cheat Sheet says moderate only; unresolved. Density: eSUN 1.25 vs Xometry 1.23 g/cm³, 1.24 used. Shrinkage, HDT and max service temperature are not well documented for support grades; the 75 °C service figure is single-source (Xometry)."
  }
}
